reviewId,userName,userImage,content,score,thumbsUpCount,reviewCreatedVersion,at,replyContent,repliedAt,appVersion
1e117df0-42b0-4315-ae0a-3ac2aedb16c6,Melinda Djorebe,https://play-lh.googleusercontent.com/a-/ALV-UjUdqRi72Wlg3y8Con1x3ekrJx4KGy9gEkUgpIwewf_wXkL5,"Aplikasi apaan ini? Coba investasi karena katanya klo penjualan uangnya masuk ke rekening pling lama 7 hari dan skrang udah setengah bulan uangnya blm masuk juga. Ribet, banyak alasan, katanya harus kirim mutasi rekening dan saya udah kirim katanya ga lengkap, trus mereka bilang mereka yg akan cek. Skrg uang saya masih blm masuk, bahkan saya kirim buktinya dan skrg mereka blg harus pke rekening koran. Aduh ga percaya lagi sama aplikasi ini, timnya ga pasti 👎hati2 penipuan ya guys! Kita ga tau",1,20,2.2.2,2020-09-24 11:03:17,,,2.2.2
44bf171e-46cf-4877-ad09-8e5a1da187ce,Uswatun Malang,https://play-lh.googleusercontent.com/a/ACg8ocLgqH-VKW_Zy-FK95Nolo-QgQfDY6QHcoTLeJ-zYepV=mo,"Suka bgt sama interface nya, ga ribet. Trus ditambah lagi ada panduan buat yg beginner, mantap deh sukses selalu ya bibit",5,1,2.2.2,2020-07-24 12:55:27,,,2.2.2
3aba5c49-d20f-4acb-9947-af72352c5197,Muhammad Helmi,https://play-lh.googleusercontent.com/a-/ALV-UjVu5qdQkvOw3VVcGTnfT0M9nvHKd1zdChPb4QMohFBIr_DE,Aplikasi nya bagus cocok banget bagi kalangan muda dan yg tua. Asalkan rutin nabung sebulan sekali pasti keuntungan nya juga bertambah,5,1,2.2.2,2020-07-07 02:15:17,,,2.2.2
58e3ed9a-3266-4cc1-95be-f3e022b67b0f,M Ragil AS,https://play-lh.googleusercontent.com/a-/ALV-UjVGkoCOSN8JbqSAQU8qvC1bVawveRo9VODPlk43L4zsn78,"Pembelian cepat, tapi pas pencairan dananya sangat lama dan cenderung sulit yaa, padahal sudah tertera maksimal 7 hari kerja, tetapi sekarang sudah hampir 1 bln masih ad pencairan yang nyangkut, mohon diperhatikan ya buat management, solnya ini menyangkut kenyamanan nasabah dalam transaksi",1,349,2.2.2,2020-07-14 11:47:38,,,2.2.2
74d3c6a8-c28d-4c90-bba8-5d445126e08c,Wisnu Suryanto,https://play-lh.googleusercontent.com/a-/ALV-UjUM9dw77DNuFBVBqivtLpgfXk71_l5T6zJFJg1JrHs05uc,"Sangat kecewa, aplikasi tidak bisa di jalankan padahal koneksi internet sangat stabil.. tapi keterangan status ""mohon periksa koneksi internet"" .. tolong berikan solusinya",1,6,3.8.0,2021-05-08 22:17:43,"Hai Wisnu, silahkan kakak coba force close & clear cache terlebih dahulu, lalu buka kembali aplikasi Bibitnya. Jika masih terkendala dan pada Play Store kakak aplikasi Bibit sudah tersedia versi terbaru, silahkan diupdate terlebih dahulu ya kak. Info lebih lanjut silahkan hubungi layanan live chat Bibit atau WA di nomor +622150864230. Terimakasih",2021-05-10 04:18:59,3.8.0
8dd07645-e2e3-40cf-829e-675ae1e40d7b,Dinda Ocarina,https://play-lh.googleusercontent.com/a-/ALV-UjVkRmn2aTyCvq8RFvBNhswRginPzyj_gKFFSFbMmiObWtGI,"Aplikasi ini bener bener super 😁👍 pemula kayak aku ga perlu bingung bingung mau investasi. Bisa mulai 10.000 juga, enak banget. Buat yang mau dapet cashback 25.000 bisa masukin kode referral aku -> dindavica",5,2,3.2.2,2020-11-25 04:46:53,,,3.2.2
53ee14ab-f21b-4620-8e94-c78418da7338,Cindy Amzal,https://play-lh.googleusercontent.com/a/ACg8ocKSbe90ubuucaIl4gf5e8fpAnq4S4fm8s_bZyjJcipE=mo,"Bagus banget untuk pemula. Uinya juga ngga ribet. Jujur sebenernya jarang dan males banget ngereview aplikasi di playstore, CUMAN karena ini emang beneran bagus jadi berani. Ayo yg masih muda yg udh punya ktp pada buruan deh. Mana tau ntar pas kuliah mau jalan2",5,3,3.2.1,2020-11-19 00:06:20,,,3.2.1
343c62e0-1e00-4d5e-8067-8ce0360a0bfd,Ikhwanul fadli,https://play-lh.googleusercontent.com/a-/ALV-UjUnHr5MqwLLLS5KOyMbRQMfIVcT1n16DsIzeM4Bb0rZQOw,Semua fitur-fitur nya sudah nyaman. Yang harus diperbaiki menurut saya yaitu tolong filter reksadana tetap ada setelah kita keluar dari melihat detil reksadana,4,2,3.12.1,2021-07-08 08:06:20,,,3.12.1
9771a94c-726b-4011-afea-01447f661e78,Samuel Slamet Purwanto,https://play-lh.googleusercontent.com/a-/ALV-UjWUyTLl27TKPzNoy0ZHYmOU0fez-7ank52mY29o1ds9p1A,Aplikasinya masih ada bug untuk android versi 9 di sebagian tampilan seperti ada bagian yang belum muncul dan pengulangan gambar yang sama.. tolong di perbaiki agar saya juga bisa mengunakan aplikasi ini juga,3,17,3.14.0,2021-07-21 02:15:39,,,3.14.0
1a9f55f8-4024-40f6-a4da-614f3ef6bd7e,Lenny Kurniati,https://play-lh.googleusercontent.com/a/ACg8ocLijtTrRqehPx07pIX9IKB9lCs_ZBtaszN366iqhN13=mo,"Menurut aq bibit aplikasi yg mudah digunakan bagi pemula untuk memulai investasi sejak dini, Bisa dapat UANG dengan gampang. Apalagi ketika KAMU memasukan CODE refferal ""BIBITBONS25K"" di HP KAMU, ketika daftar pertama. Terima kasih bibit. CODE refferalnya WORK. 😋",5,1,,2020-05-31 01:43:10,,,
284c84ba-93b8-40a6-a3ae-d2b352a75363,Pengguna Google,https://play-lh.googleusercontent.com/EGemoI2NTXmTsBVtJqk8jxF9rh8ApRWfsIMQSt2uE4OcpQqbFu7f7NbTK05lx80nuSijCz7sc3a277R67g,Pertama instal Bibit investasi cukup puas krn cepat prosesnya dan harapan bisa up to date selalu progress nya..sip .keren deh ...pokonya rekomended aplikasi buat semua..mantap..,5,2,1.2.10,2020-01-17 06:27:39,,,1.2.10
5160f312-b291-461d-bb83-b6cbbb42368b,Sarinande Blues,https://play-lh.googleusercontent.com/a/ACg8ocJwSuh8_kChSQ_WMXh2paft3B1b_Pi7bzMT2Q0wH777=mo,"Aplikasi yang sangat bagus cocok buat kalian yang ingin belajar investasi, jangan lupa masukan kode referral ( CITAKU ) saat awal kalian mendaftar supaya dapat bonusnya 25ribu, dan bonusnya juga bisa di cairkan atau di buat investasi, pokoknya menyenangkan sekali gaes belajar investasi di aplikasi Bibit, dan bersama kita bisa. 😊😊😊",5,1,,2020-07-06 02:14:00,,,
1e07d89f-4721-4c58-bb0f-d788daa9526e,Hprawira 91,https://play-lh.googleusercontent.com/a-/ALV-UjWe-A2mPajbYyvS-cPwsEhixClhtz2UBKgWQoEzs4jMcOK8,"Jujur ya, saya sebenernya coba"" top up 100k untuk mencoba aplikasi ini bagus apa tidak . 1. Dari kita pembelian aja masuknya lama bangetttt 2. Untuk penjualan hasil menjual itu gak masuk full + lama banget masuknya 3. Kalau kalian mau coba mending coba yg dikit"" aja dulu",1,55,3.3.2,2021-01-04 04:55:35,"Hai kak untuk transaksi akan berhasil maks 2 hari kerja ya kak, dan untuk transaksi penjualan sampai masuk ke rekening kaka bisa ditunggu maksimal 7 hari kerja dari status penjualan berhasil. Untuk info lebih lanjut kaka bisa menghubungi tim support kami pada layanan live chat atau via wa di nomor +622150864230. Terimakasih
",2021-03-02 05:48:46,3.3.2
0b88ea3c-02f3-4934-85a5-8862cae51c40,Indra Mulyadi,https://play-lh.googleusercontent.com/a/ACg8ocKNKQNwp4p5tW908iFHNqet4ZWM-WiXrYFRfdIPdafy=mo,"Aplikasinya bagus, Lebih baik invest sesuai jadwal, dan JANGAN PERNAH TERGIUR melihat promo cashback PHP (penuh harapan palsu). Promo cashback paling ga jelas ya di aplikasi ini. Semua syarat dan ketentuan sudah terpenuhi. Kuota promo terbatas tapi data tidak transparan?. Kuota berapa? Siapa yg dapat? Atau mungkin hanya gimmick. ?? Lebih baik tidak usah promo kalau hanya mengecewakan user dan ujung-ujungnya tidak mendapatkan apapunnya Alias NOL. Maaf saya kasih bintang 1 dulu.",1,124,3.2.3,2020-12-15 10:17:31,,,3.2.3
fafef3b4-ac03-4542-b3d0-f2bc10963ab4,Pengguna Google,https://play-lh.googleusercontent.com/EGemoI2NTXmTsBVtJqk8jxF9rh8ApRWfsIMQSt2uE4OcpQqbFu7f7NbTK05lx80nuSijCz7sc3a277R67g,"Saya baru install dan setiap mau buka aplikasi ini selalu force close, sudah saya ulangi seperti uninstall install lg tp ttp force close. Untuk memori di hp saya jg msh lumayan ada 1Gban. Ini kenapa ya?tolong ditindak lanjuti..krna antusiasme saya memilih menggunakan ini drpada aplikasi reksadana yg lainnya sangat tinggi. thanks",1,2,,2020-04-25 05:27:38,"Hi Kak, kami sudah tidak support hp android versi 5. Silahkan di upgrade hp nya supaya bisa menggunakan aplikasi bibit kembali. Terima kasih.",2020-04-25 08:34:08,
1b10190a-faa6-47ac-825b-f2350343aa8b,Dewa Alher (Dewa Alher),https://play-lh.googleusercontent.com/a-/ALV-UjWs0OaAEk_5wylKle8I919EZzaLHnhhOWPTryot1Bkndvw,Ini aplikasi yang bagus untuk belajar investasi bagi pemula.. Untuk yang advance juga saya rasa sangat memudahkan.. Fitur auto portofolio juga sangat membantu bagi pemula yg bingung dengan Reksadana mana yg mesti kita beli.. Sedikit saran dari saya tolong tambahkan fitur metode pembayaran lewat minimarket/semacamnya.. itu akan sangat memudahkan kita yang hanya memegang uang cash.. Terimakasih..,4,20,2.2.2,2020-06-06 01:28:42,,,2.2.2
ae1f1a60-5617-4fb5-9abc-c6877061ed76,Ahmad Fauzi,https://play-lh.googleusercontent.com/a/ACg8ocLZlg-jaXxGYp_2c9V_3NSfdwckhS0XJiEcEr1JEFGgLw=mo,"sangat membantu sekali untuk para pemula yang ingin berinvestasi. apalagi dengan adanya Rebalancing otomatis, sangat membantu sekali. Recommended banget dah Bibit.",5,5,3.2.3,2020-12-08 00:35:54,,,3.2.3
224fa4cc-c7fa-467b-ad98-52ddd4e03875,Cokorda Putra,https://play-lh.googleusercontent.com/a/ACg8ocJx6nYcvDtsodPJPHTdleEzFAqLlYy3s1DalfTFuBZS=mo,"Kenapa setelah diperbaharui dan setelah top up saldo,, aplikasi bibit saya tidak bisa dibuka,? Signal dsni kuat,, dan kuota saya masih banyak,, jdi sudah jelas bukan pnyebabnya dri aplikasi bibit itu sendiri,, tlng tanggapan secepatnya!!",1,17,3.11.1,2021-06-17 04:15:02,"Hai kak Putra, kami mohon maaf atas kendala yg dialami. Untuk kendalanya silahkan kakak coba force close & clear cache terlebih dahulu, lalu buka aplikasi Bibit kembali. Jika masih terkendala, harap langsung menghubungi live chat Bibit atau WA +622150864230 agar tim kami dapat segera telusuri dan bantu lebih lanjut masalahnya. Terimakasih",2021-06-18 05:02:40,3.11.1
113167a9-8e5e-475c-aebc-775d37039b99,Siti Nasiah,https://play-lh.googleusercontent.com/a-/ALV-UjWyo2jbeTNzidZ7M5QlTu75KAcgYebhzw1T-COmNGhE59A,"KODE : raishecuan tuk cashback 25.000 Baru sebulan pakai bibit, di bantuin banget apk nya juga mudah di pahamin. Pembayaran ga ribet. Next ditunggu payment lewat dana dan tambahan fingerprint nya ✨✨✨✨",5,2,2.2.2,2020-07-30 00:00:31,,,2.2.2
ec95b734-1351-4b0e-8ca9-9b0c9f0f79c1,Aman - CaVie,https://play-lh.googleusercontent.com/a-/ALV-UjUJM6kN2hIbBvZ-kDaF82BafobkOC0OVdJJbm3-zQhqZQ,"Berkat aplikasi Bibit, saya jadi bisa menghilangkan kebiasaan top up game online dan bermain game. Terima kasih Bibit. yang mau dapet Cashback 25k bisa pakai code ini guys : (arima). Lumayan bisa buat nambah modal kalian di Aplikasi Bibit, Terimakasih.",5,1,,2021-10-08 04:53:25,,,
b9285e51-c2c3-4d1b-a24f-84de77d489a5,Pengguna Google,https://play-lh.googleusercontent.com/EGemoI2NTXmTsBVtJqk8jxF9rh8ApRWfsIMQSt2uE4OcpQqbFu7f7NbTK05lx80nuSijCz7sc3a277R67g,"Untuk pemula seperti saya sangat membantu karena fitur2 nya mudah dicerna, dan Customer Service nya cepat menanggapi. Sukses lah pokoknya buat Bibi.. 😉",5,2,1.2.10,2019-10-23 02:17:25,,,1.2.10
68c57910-9b43-478b-8a82-79fd57a7e84d,Pengguna Google,https://play-lh.googleusercontent.com/EGemoI2NTXmTsBVtJqk8jxF9rh8ApRWfsIMQSt2uE4OcpQqbFu7f7NbTK05lx80nuSijCz7sc3a277R67g,"Saya sebagai pemula merasa puas.. krn sangat mudah berinvestasi reksadana di Bibit.. Tp ada satu pilihaninvestasi saya yg tiba2 menghilang, jadi tidak bisa dibeli lagi.. padahal menurut saya itu prospeknya baik.. tolong kalau bisa dimunculkan kembali... masukan dari saya kedepannya lebih diperbanyak lagi menu pilihan investasinya khususnya yang Syariah... Mantab...👍",5,3,1.2.7,2019-09-12 19:18:47,,,1.2.7
a4e73a60-e61c-42f1-9525-bee1f209a4f1,Agam Putra,https://play-lh.googleusercontent.com/a-/ALV-UjVBhqeqhItMGGo7J5tK3gWbau9N8O0LskYcxX90jwnSDN4,Bibit aplikasi investasi reksa dana yang sangat cocok untuk pemula. Tidak membuat si pengguna nya kebingungan cara pakai nya. Tampilan nya juga user friendly banget. JOSS DAHH BUAT BIBIT:),5,17,3.2.3,2020-12-03 23:52:35,,,3.2.3
5cc671c1-22d6-45b0-83ac-e1844d918d8f,Pengguna Google,https://play-lh.googleusercontent.com/EGemoI2NTXmTsBVtJqk8jxF9rh8ApRWfsIMQSt2uE4OcpQqbFu7f7NbTK05lx80nuSijCz7sc3a277R67g,"Mudah dimengerti, membuat investasi jadi enggak membingungkan. But please tambahin fitur supaya bisa enak dilihat walaupun orientasi hp/tablet sedang dalam posisi landscape atau potrait terbalik.",5,4,1.3.3,2020-03-04 09:05:36,,,1.3.3
21182dcf-a696-4d4e-83f9-e54b341f55bb,Rini Husadiyah,https://play-lh.googleusercontent.com/a/ACg8ocJtQU2c-4zMBrznoiMZPzGqoFXgGR4kcD1Bu0F1WjC3=mo,"Bibit tidak ada pemberitahuan ketika reksadana yang dijual sudah masuk atau belum. Saya menjual 4 reksadana tetapi hanya 1 yang masuk kerekening saya, di aplikasi bibit nya sendiri tertulis order jual berhasil Katanya maksimal 7 hari kerja, tapi apa? Hanya 1 yang masuk ke rekening saya. Membeli reksadana nya memang gampang, tetapi untuk menjual reksadana nya kenapa tidak jelas begini? Bibit dengan embel investasi tanpa ribet, praktis, hahahha dengan kepraktisan anda BANYAK ORANG MERUGI, ga jelas",1,96,3.12.0,2021-06-26 17:03:28,"Hai kak Rini, notifikasi dana sudah dikirim/belum dari Bibit memang tidak ada ya, karena dana penjualan dikirim langsung oleh Bank Kustodian ke rekening terdaftar di Bibit. Maks 3 hari kerja utk RD Pasar Uang dan maks 7 hari kerja utk RD Saham & Obligasi. Pastikan rekening aktif & cek pada wkt tsb, more info hubungi live chat Bibit/WA +622150864230",2021-06-28 04:48:28,3.12.0
62aff654-10d6-4b7e-a39c-7cb72b29adb9,Yuliana Tri Windarti,https://play-lh.googleusercontent.com/a-/ALV-UjWz9iWG7DAHN9gur3jQJUxdfVTiEikdV_8-jvKJM1lDwZUv,"Mau ngecek dana kok dari kmren aplikasi gak bisa dibuka, muncul koneksi tidak ada coba lagi. Upgrade udah, dihapus data udah. Tetep aja gak bisa. Kenapa ini",1,8,3.8.0,2021-04-08 04:02:27,"Hai Yuliana, terkait kendala kamu silahkan pastikan jaringan internet sudah stabil ya, lalu coba untuk force close & clear cache terlebih dahulu dan buka kembali aplikasi Bibit nya. Jika masih terkendala kakak bisa menghubungi layanan live chat Bibit atau via WA di nomor +622150864230. Terimakasih",2021-04-09 05:16:10,3.8.0
bafd936d-c7aa-424f-bb57-a50945d5de50,Pengguna Google,https://play-lh.googleusercontent.com/EGemoI2NTXmTsBVtJqk8jxF9rh8ApRWfsIMQSt2uE4OcpQqbFu7f7NbTK05lx80nuSijCz7sc3a277R67g,"Kasih bintang 2 dulu aja, karena baru mulai juga, tapi overall belom nemuin yang problem yang aneh. Untuk pemula saya rekomendasikan ketika ingin memulai investasi reksadana pahami juga sistem nya sekarang udah banyak buku terkait reksana, maaf bukan menggurui !!!",3,2,2.1.0,2020-04-21 21:36:34,,,2.1.0
3cfb0367-2de3-4afd-834a-5058ac0e1349,Prima RD,https://play-lh.googleusercontent.com/a-/ALV-UjXYQPlOf1RdQqh8Uv0jYOJU6STzETMkrjbTL6ThCtI4EV0,Bibit memberikan pengalaman yang menyenangkan bagi investor pemula seperti saya. User Interface yang simple dan mudah dipahami membuat pengguna tidak bingung dalam menentukan pilihan. Tim juga siap membantu apabila pengguna memiliki pertanyaan-pertanyaan seputar aplikasi Bibit. Saya sangat merekomendasikan aplikasi ini. Bagi yang penasaran silakan mencoba.,5,9,3.1.2,2020-10-05 13:53:14,,,3.1.2
bff224c5-2c7d-40c5-927b-8ac6cf288f71,Pengguna Google,https://play-lh.googleusercontent.com/EGemoI2NTXmTsBVtJqk8jxF9rh8ApRWfsIMQSt2uE4OcpQqbFu7f7NbTK05lx80nuSijCz7sc3a277R67g,"Pilihan reksadana memang tergolong sedikit, tapi bagi saya cukup karena pilihan yang diberikan adalah yang bagus-bagus. Fitur Robo juga sangat membantu dalam mengatur penempatan secara automatis. Semoga terus berkembang dan berkelanjutan",5,1,1.2.5,2019-06-29 06:36:41,,,1.2.5
cda89ba1-7f96-446b-aa68-cbab4eb566eb,Pengguna Google,https://play-lh.googleusercontent.com/EGemoI2NTXmTsBVtJqk8jxF9rh8ApRWfsIMQSt2uE4OcpQqbFu7f7NbTK05lx80nuSijCz7sc3a277R67g,"Aplikasi bibit sungguh keren untuk berinvestasi bagi pemula karena banyak tutorialnya, dan bayarnya bisa lewat apa aja kayak gopay, link, dll.",5,2,1.3.0,2019-12-06 13:31:42,,,1.3.0
64d42864-9836-444f-9889-dc5b9e54d70c,Rahmat Hidayat,https://play-lh.googleusercontent.com/a-/ALV-UjUJQHZqoi8mCkulGOFWbRa8YffJkE3ONKLpTriS9nq3qRc,"Saya bingung.. Knp harus pake foto kpt + selfie + tandatangan... Sekarang pinjam uang online sangt mudah,, dan data kawan saya pernah disalahgunakan sama mereka yg gak bertanggunh jawab... Tidak menutup kemungkinan akan ada oknum bibit yg bermain.... Klo bisa investasi dengn mudh kenapa harus ribet dan menimbulkan resiko yang lain... Tolong di buat lebih fleksibel, mengingat bukan semua yg invest disini di untung kan.. Tetap yang untung yg punya aplikasi Thanks",2,87,3.5.0,2021-02-27 02:09:55,"Hai kak, Bibit sudah mengikuti standar keamanan untuk lembaga keuangan. Untuk komunikasi data, data yang kamu kirim ke bibit telah terenkripsi dengan aman. Sedangkan, untuk penyimpanan data kamu juga bibit simpan dengan menggunakan enkripsi AES-256, yang merupakan sistem enkripsi yang umum dipakai oleh lembaga-lembaga keuangan lainnya.
",2021-02-28 14:30:54,3.5.0
c230ce68-40a3-4098-80ee-0c65545e1479,riyan X,https://play-lh.googleusercontent.com/a-/ALV-UjVB3I2rK0mNfAEQaM7PflGtUeLQRQoNgpZ5yNSrlY1CBg,"Setelah saya daftar, awalnya oke oke saja. Namun saat pencairan kena potongan bank its okelah dapet cashback 3500. Tapi cashback hanya bisa dipake saat beli rekom Robo yg notabene berisi 3 reksadana yg bukan pilihan sendiri. Kurang menarik. Saran dari saya, jika cashback harusnya bisa dipakai untuk semua transaksi(tidak pilih-pilih). Ternyata masih mending bukareksa bukalapak.",1,147,2.2.2,2020-08-08 01:36:56,,,2.2.2
a0eae040-3c51-4e58-8615-a7e6e466de6c,Alvian Lazuardy,https://play-lh.googleusercontent.com/a-/ALV-UjUgQoAwh9i8o4n6qZs0jq30eNzJTajz3bSHg54t8suyKyQ,"Tolong untuk ""updatenya"" harus selalu standby yah, karna yang bertransaksi selalu ada terus setiap harinya. Kan binit perusahaan online, jadi harus selalu online dalam segi update ataupun segi keamanan. Karna rasa percaya itu mahal",4,23,3.2.2,2020-11-30 17:33:33,,,3.2.2
20b141c2-c6ac-497c-b667-ac6a1d084676,Muhammad Febrianza Wiranata,https://play-lh.googleusercontent.com/a-/ALV-UjVSFUE39qS3zPsQpyiOb9U7MHhgnqlk78Pr0u-IjZwFXTT6,"Aplikasi nya mudah digunakan dan bagus, cuman sangat berat dan lemot, kalah sama bareksa, pluang, dll yg lebih ringan, mohon diperbaiki bagaimana bisa berat gitu pdhl yg lain uk apk nya gak jauh beda, tp bibit lebih berat.",1,110,3.38.3,2022-09-01 11:24:59,"Hai kak, silakan coba force close & clear cache terlebih dahulu lalu buka kembali aplikasi Bibit. Jika masih terkendala & pada Play Store aplikasi Bibit sudah tersedia versi terbaru, silakan update terlebih dahulu ya. Info lebih lanjut hubungi layanan live chat Bibit/WA +622150864230, tim support kami pasti akan langsung membantu kakak. Trims",2022-09-01 14:35:04,3.38.3
98412f0c-8b5b-4074-a90b-7a9d7da7990b,Ahmad Ahsani Taqwiim,https://play-lh.googleusercontent.com/a/ACg8ocKzEtRPhHDuybZ73ppB1kK1z1kR38TVHbLa02JNHsKSSw=mo,"Sudah bagus aplikasinya, fitur juga cukup mudah, namun tolong diperbaiki sistem jualnya, saya jual pasar uang tulisanya maks 3 hari kerja, baru sampe rekening saya sekitar 10 hari. Jika bisa diperbaiki sudah lengkap bibit pokonya👍",4,12,3.16.3,2021-10-13 11:10:25,,,3.16.3
35ddbf10-580c-4405-b89b-8240e66eaea1,Prayugo CA,https://play-lh.googleusercontent.com/a-/ALV-UjUp_ItJrT4-JkygsLX52uPkElnce69G9N8IxBK6vvU4ixE,"perlu dikembangkan lagi. kecepatan membuka aplikasi perlu di upgrade, fitur2 untuk memudahkan jg, saya kasih masukan untuk ada fitur chart pembanding antar produk semoga segera ada. dan ditunggu juga fitur2 keren lain.",3,10,2.2.2,2020-06-13 03:06:18,,,2.2.2
ab07fffc-d1b1-4e5c-9267-08db967a1a03,Rita Sugiharti,https://play-lh.googleusercontent.com/a-/ALV-UjUbdM73GAIHsPwdYCA5VvTU9HhHFHE-ddQ-AVfGMH1CD3g,"seneng banget bisa belajar inves sama nabung juga di apps ini. kalo yg belum ngerti ttg reksadana bisa tonton videonya bang raditya dika di youtube, disana penjelasannya ringan bgt dan mudah dimengerti. oiya buat yg baru daftar jangan lupa pake kode referal ini ya 7xuuwim. semangat beraktivitas semuanyaaa💛",5,1,3.2.1,2020-12-04 01:36:20,,,3.2.1
83a867fe-0e5c-4068-b72c-6c2eb84035c9,Pengguna Google,https://play-lh.googleusercontent.com/EGemoI2NTXmTsBVtJqk8jxF9rh8ApRWfsIMQSt2uE4OcpQqbFu7f7NbTK05lx80nuSijCz7sc3a277R67g,"Kepada admin yang terhormat tolong diperbaiki lagi aplikasinya. Saya pertama mau mulai daftar mau masukan foto KTP dan foto selfie di aplikasi selalu keluar. Saya sudah coba beberapa kali namun nihil. Tolong diperbaiki lagi untuk bisa di semua ponsel tanpa terkecuali agar pengguna bisa mencangkup semuanya. Ponsel saya Asus Zenfone Live namun nggak bisa upload foto KTP dan sefie, kalau sudah diperbaiki baru saya mulai kembali dan bintang 5 nya. Terima kasih",1,2,,2019-08-26 07:07:17,Silahkan chat dengan tim support kami supaya dapat dibantu dengan tuntas. Terima kasih.,2019-08-26 08:27:05,
19d01e3c-7d3b-4b50-803e-e731b92477d1,Pengguna Google,https://play-lh.googleusercontent.com/EGemoI2NTXmTsBVtJqk8jxF9rh8ApRWfsIMQSt2uE4OcpQqbFu7f7NbTK05lx80nuSijCz7sc3a277R67g,"Keren aplikasi ini. Pembayarannya sangat mudah, pengoperasian nya mudah.... Saya sebagai pemula yg masih 2 bulan menggunakan Bibit tidak terlalu memperhatikan besar returnnya... Tempat menabung yg recommended banget ,🤟",5,18,1.3.2,2020-02-15 17:21:02,,,1.3.2
5469782d-d61c-4a9e-b375-6df1b87ebedc,jason dinata,https://play-lh.googleusercontent.com/a/ACg8ocIYY-rv0SAeHfcAmuAgMLxF319_MkxXW9FBHmLDMGKk=mo,"aplikasi invest nya bagus. walaupun csnya banyak/ganti, jawaban mereka mudah dimengerti. yg kurang hanya lamanya waktu withdraw & top up selain itu bagus smua ga ribet(simple)",5,2,,2021-12-24 07:32:25,,,
a07b0222-1dc5-41c1-8a4b-b38a9d5ce4dc,Kyousuke Hasegawa,https://play-lh.googleusercontent.com/a-/ALV-UjUqT6dg4CaaTBucxWSzsvgIWTz04VUhrnn9BN2BRDqhZQ,Tambahin juga dong metode pembayaran dan penerimaan hasil jualnya dengan DANA dan virtual account Bank Muamalat. Untuk saat ini untuk jual beli Reksadana yg bisa bayar dan terima hasil jualnya lewat DANA baru B*******K. Mudah-mudahan kedepannya disini juga bisa. Karena bisa menghemat biaya admin.,4,190,3.25.0,2022-01-06 22:57:43,,,3.25.0
c1af540a-fa82-46fe-b94f-c5dc6be3398f,Junaidi Muntoyib,https://play-lh.googleusercontent.com/a-/ALV-UjWk03NpUmt78JfpzqOjkltKB3Pe1VNRQaQ7s0IC5l5VvbU,"Pakai kode referal ""lumbungbibit"" dan dapatkan cashback 25k, lumayan kan transaksi pertama dapat suntikan tambahan dana investasi. Pengalaman sebulan pertama pakai bibit cukup puas, mudah dipelajari terutama bagi pemula. Ada Robo advisor juga yang bisa merekomendasikan portfolio investasi mana yang cocok sesuai dengan preferensi masing-masing user.",5,0,,2022-07-01 01:16:23,,,
d05d1049-710a-4e0b-93c4-ca950149700c,HDN Talks,https://play-lh.googleusercontent.com/a-/ALV-UjXc_Wk57e_t-KPobGVnQNdkIwj__RRPIufYo3d2Dd4A2Q,"Saya suka ap bibit, cuma sayang responnya tidak efektif. Seharusnya hanya 1 orang saja yang merespon dan langsung menyelesaikan tsb dengan user. Jika user tidak merespon selama beberapa saat, lgsg akhiri saja sesi tanya jawab tersebut. Bukannya malah semua admin ikut menjawab, itu malah membingungkan, terlebih waktunya yang diberikan juga tidak diatur (terlalu fleksibel) jadi juga terlalu lama menunggu respon dari admin.",3,2,,2022-02-09 14:35:26,,,
c178edcb-7415-4315-bd09-211ad20d04da,Pineapple,https://play-lh.googleusercontent.com/a-/ALV-UjXDCW6Kc0wVm6dTMc330hLCWb9jP75FdKmmP-7psXpATw4,"Cukup mudah dipahami sebagai pemula seperti saya, tapi mohon dikasih pilihan pembayaran via DANA dong admin atau tidak SHOPEEPAY juga boleh. Di tempat saya top up gopay/link aja susah, gak semua punya ATM dan bertahan hidup di tempat elite. Mohon di kasih ya dan pertimbangkan!. Kali ini 3½ star dulu!",3,80,3.8.0,2021-05-13 04:53:44,,,3.8.0
38b891b6-7039-4ae7-9ba7-bc1d106d4751,irfan_ad6,https://play-lh.googleusercontent.com/a-/ALV-UjXFY4IsQoq2fsftxa4Z1IMOj6xcf1GyZYLt-_W9uhMMg7g,"Aplikasi ini sudah terbukti terpercaya, saya sudah 4 bulan invest di bibit dan saya jual lagi, cepat dan langsung masuk rekening... Owh yha min cuma Bisa ditambahi lagi investasi nya tidak hanya Reksadana namun juga bisa di kasih fitur investasi emas, investasi bitcoin... Bisa di upgrade lebih baik lagi dan ditambahkan fitur-fitur nya min... Dari semua sudah okk, sara saya tadi kasih tambahan fitur-fitur baru ... terimakasih 😁🙏",5,1,,2021-07-27 17:49:31,,,
85d4333a-763f-4399-8f6d-9338816175af,Rahmatia,https://play-lh.googleusercontent.com/a-/ALV-UjWh5jDeI4fg3aOVY_qsVqOPUMskuhMtdRwsWrIAGvOvpA,"Untung aja nabung pas lagi ada duit di bibit, pas butuh dan ga ada duit samsek bisa narik, dan keuntungannya walopun ga terlalu besar tapi oke² aja si. Sejauh ini bagus kok, buat pengguna baru yg mo coba investasi pake bibit, bisa mulai belajar dari sekarang. Eh kalo baru pertama kali daftar bisa masukin kode 'kuascat' lho dan dptin 25k. Selamat menabung~",5,2,,2022-01-18 04:23:53,,,
aed2a055-1dc1-4ac7-af07-de2a3914fb44,Akbar Alif,https://play-lh.googleusercontent.com/a-/ALV-UjVRAhogqnNg4J7LLsW9kxPt6sH_pLg_T0kYgiozZrchupM,"aplikasi ini sangat membantu saya dalam merencanakan investasi pada kurun waktu tertentu. tidak hanya itu, pembayaran nya pun banyak pilihannya. semua metode pembayarannya mudah, sederhana, dan praktis ga ribet.",5,45,3.7.1,2021-03-29 11:57:08,,,3.7.1
effc2e8d-af99-4c6e-b914-e6b6eb6519e3,Pengguna Google,https://play-lh.googleusercontent.com/EGemoI2NTXmTsBVtJqk8jxF9rh8ApRWfsIMQSt2uE4OcpQqbFu7f7NbTK05lx80nuSijCz7sc3a277R67g,Bibit keren top upnya mudah dan gak ribet apa lagi pakai link aja gak kena biaya tambahan. Kedepannya system keamanan dan transaksi di tingkatkan lagi.,5,1,,2020-01-18 10:42:56,,,
