reviewId,userName,userImage,content,score,thumbsUpCount,reviewCreatedVersion,at,replyContent,repliedAt,appVersion
ea186b9c-dd76-4502-9cbb-3740bad3771f,BAL BALE,https://play-lh.googleusercontent.com/a/ACg8ocJjeFktH570cZwDtWClqR8txnkHz029YS-qYH26GIQk=mo,"Untuk konsep dari aplikasinya udah bagus sih ngasih kemudahan buat kita yg pingin ngelakuin hal semacam investasi tanpa takut penipuan but problem dari saya si cuma satu yaitu ""harus punya rekening sendiri"" Padahalkan banyak juga anak anak muda termasuk saya yang pingin belajar investasi sejak dini sedangkan belum punya rekening, mohon ditingkatkan lagi aplikasinya 🙏",2,34,3.5.0,2021-02-20 19:36:27,"Untuk registrasi harus menggunakan KTP/surat keterangan dan Rekening Bank atas nama kaka pribadi yang terdaftar di Indonesia. Jika belum punya KTP/Rekening bisa buat dulu ya. Jika perlu bantuan terkait registrasi Bibit, kamu bisa hubungi tim support lewat aplikasi atau melalui WA di nomor +622150864230. Terimakasih.
",2021-02-21 12:39:13,3.5.0
cb9388f9-3d5c-4941-b5c4-fa5d3a95fd4a,Pengguna Google,https://play-lh.googleusercontent.com/EGemoI2NTXmTsBVtJqk8jxF9rh8ApRWfsIMQSt2uE4OcpQqbFu7f7NbTK05lx80nuSijCz7sc3a277R67g,"Aplikasi bibit masih perlu dikembangkan dan di update lagi terutama sisi keamanannya, user interfacenya dibuat menarik tapi tetap minimalis, tambahin jga fitur pembayaran via LinkAja! Dan dompet2 digital lainnya yang penting tetap gratis admin y😂, smoga bibit bisa jadi aplikasi fintech besar dan sukses dan tetap konsisten",5,3,1.2.9,2019-09-12 10:43:47,,,1.2.9
17bf7aae-41ae-4c34-92f9-f2dcb76ff637,Pengguna Google,https://play-lh.googleusercontent.com/EGemoI2NTXmTsBVtJqk8jxF9rh8ApRWfsIMQSt2uE4OcpQqbFu7f7NbTK05lx80nuSijCz7sc3a277R67g,"Aplikasi ini sangat bagus, mudah cara pakainya sangat direkomendasikan untuk investor pemula juga ada fitur robonya untuk membantu reksadana mana yang harus dibeli, pembayaran juga gapake ribet, bisa pakai Link aja, Gopay juga bisa. Oh iya gunakan kode referal supaya dapat cashback Rp. 50000. Caranya, download aplikasi bibit, buat akun, dan masukkan kode referal deh.⚡ ((Kode referal: getcashback))⚡. Selamat mencoba!!!",5,9,,2019-11-05 07:55:03,,,
efbedf17-8f45-4308-8bee-cc894abfb225,Hay 18,https://play-lh.googleusercontent.com/a-/ALV-UjUyJZDM79PNScNSo9BvkieUOFR0ALw8_gxpbSxdRBI_UD0,Kasih 5 biar kebaca. Saya download krn mau cari apk trade yg lain. Dan setelah download ko lama bgt. Iy emng lama pasti. Dan pencairannya lama bgt. Akhirnya sya beralih k apk trade saya yg sebelumnya. Memang apk itu lebih besar top up nya. Tp untungny cepat dan pencairannya ga sampe 30 menit lgsg masuk no rek. Sdgkn bibit? Oh my god! 1 hari aja ga cukup kayakny buat nunggu masuk rek.,5,208,3.25.0,2022-01-24 03:09:49,,,3.25.0
22fd3fde-f269-4729-9c6e-8f95f732aff1,wisnu septian,https://play-lh.googleusercontent.com/a-/ALV-UjUmHQek5HUeyFd4rhC4Sf4zEdTeB6_U28ZqWEJXtEPemh0,"Aplikasi investasi pertama di hp saya, karena paling simple, UI nya keren mudah di pahami, ada fitur robo advisor buat yg bingung mau invest di mana..",5,2,2.2.2,2020-07-11 07:08:29,,,2.2.2
3696afa7-3928-4dd1-9017-9334e3656005,Hendro Bayu Aji,https://play-lh.googleusercontent.com/a-/ALV-UjVGnOQ5erdL2dLUwa11JGXLj70zKjpyKUpSdMaPQjgI8w,Rentang waktu pencarian dana tabungan ke rekening sekarang lumayan lebih cepat. Terus improvement ya Bibit. Terlebih improvements di bidang keamanannya.,5,1,,2022-09-23 13:59:24,,,
572eafd8-6875-4876-8fd6-c9c3b9e2d9d5,Alika Fatih,https://play-lh.googleusercontent.com/a/ACg8ocL9Zb-W487W70GzSfgGtIpeti-3SRiw1nsRuu3LmN23=mo,"Aplikasi ngk berguna, yg di untungkan hanya pemilik aplikasinya aja, uang yg yg saya tarik aja smpe saat ini blom masuk transferanya padahal uda dua minggu, saya ingetkan kalian yg mau mencoba aplikasi ini sebaiknya jangan dicoba, karna pasti kalian menyesal",1,56,3.28.1,2022-04-04 09:58:20,"Hai kak, pencairan dana ditransfer langsung dari Bank Kustodian setiap produk reksadana bisa saja berbeda waktunya. Jika dana penjualan blm diterima & sudah batas waktu dari tanggal Order Jual Berhasil (3 hari kerja utk RD Pasar Uang & 7 hari kerja utk RD Saham dan Obligasi), silahkan langsung hubungi live chat Bibit/WA +622150864230. Terima kasih",2022-04-05 06:13:51,3.28.1
dc2b2e41-6cd8-4d41-9543-901dbbecaf85,Mocha Bay,https://play-lh.googleusercontent.com/a-/ALV-UjUKbYcUiScnxd55Rg_yqt4lM0WLp8I4NeIirEIfU6RL-w,"Aplikasi penghasil uang yg registrasinya mudah,gak ribet ,CS pelayanannya ramah dan stanby 24j ,dan yg pasti gampang banget dipahami cara kerjanya ..,,yakin siapa saja yg pakai BIBIT pasti Cuan ..,,jangan lupa pakai kode referral "" DWIBA "" ya ,, biar kalian bisa dapat bonos RP.25000 ,,terima kasih",5,1,,2021-01-30 11:54:49,,,
64f5359d-ead3-44bf-980b-8267f20d319a,Sri M S,https://play-lh.googleusercontent.com/a-/ALV-UjUddYCgwsmNIuuiZffP7B8NqwusPEWMhrMJYuMqg0lKpw,"Terimakasih Bibit.id, setelah mengalami kendala tidak dapat mengakses Apk nya, sekarang saya sudah bisa menggunakan Bibit.id hanya dalam waktu 2 jam terjadi kendala, skrg berhasil melakukan top up kembali, setelah sebelumnya saya chat WA resmi Bibit.id dan koment ke IG Bibit.id respon CS nya cepat.",5,51,3.24.0,2022-01-03 04:56:58,"Hai kak, mohon maaf atas kendala sebelumnya. Kakak bisa coba kembali akses aplikasi Bibitnya saat ini. Jika masih kendala, harap langsung hubungi layanan live chat aplikasi Bibit atau bisa juga melalui DM Instagram @bibit.id maupun messenger FB untuk dibantu pengecekannya ya, tim support kami pasti segera membantu masalah kakak. Terima kasih",2022-01-03 04:41:58,3.24.0
e67679c4-7579-4b86-a06d-597a38bb1d1e,Sigit P,https://play-lh.googleusercontent.com/a-/ALV-UjXg1M2aZ-Sq6a5ArWq92_FUTRWFK9CxBWcvW-rh43e7JQ,Tolong tambah jenis verifikasi lewat sms. Kalau lewat telepon/email terpaksa harus beralih aplikasi dulu dan setelah buka aplikasi bibit kembali perlu ngulang dari awal lagi. Ribet. Kalau verifikasi sms bisa dilihat lewat notifikasi.,4,80,3.6.0,2021-03-11 04:02:05,,,3.6.0
ac6d686e-37af-475d-88e0-7a3f8a522ce9,Harun Ar Rasyid,https://play-lh.googleusercontent.com/a/ACg8ocJ6AXSXyRUn5hpYPsIKJ68YM453x_I5gWVZj3EGwIRv=mo,"Saya menyarankan agar Bibit dapat menambah jenis metode pembayaran, yaitu melalui OVO. Karena pasti ada kemungkinan pengguna aplikasi Bibit yang sebenarnya lebih sering menggunakan OVO dibanding aplikasi uang digital atau e-banking lainnya. Juga diharapkan untuk pembelian melalui OVO juga sama seperti metode pembayaran lainnya, yaitu bebas harga potongan. Terima kasih.",4,91,3.14.0,2021-07-31 11:47:43,,,3.14.0
7e97cc8a-f610-4979-9534-5f793a8cf0f1,Rahma Runindaru,https://play-lh.googleusercontent.com/a-/ALV-UjW_5W5-oro80xx53Z2cUf56o05PNlXpe90Cz1G8TgjONyqA,"Untuk saya yang betul"" buta pemahaman soal saham dan reksa dana, fitur Robo Advisor sangat membantu. UInya juga nyaman dan sangat ramah di mata, simpel. Kemudian, kemudahan dalam membayar juga sangat membantu.",4,19,2.2.2,2020-07-21 15:07:00,,,2.2.2
21fe6b70-c403-47e6-9e08-5f07f70db6ea,Aris Dwi laksono,https://play-lh.googleusercontent.com/a-/ALV-UjU0b61OgpT0FmG8FXqpkaQwyts-ocP8rniSB9l5EneJhA,"Aplikasi gk bisa optimal di hpku,sebagian layar gk Tampil,DAN g bisa scrol, ku coba buka di browser Chrome ternyata sama,akhirnya ku buka dengan opera browser hasilnya normal, jadi terpaksa saya uinstal ya app nya,terima kasih bibit",4,2,3.0.11,2020-09-11 20:04:08,,,3.0.11
661decce-19ca-47b7-8d92-91d0e5b982b3,Pengguna Google,https://play-lh.googleusercontent.com/EGemoI2NTXmTsBVtJqk8jxF9rh8ApRWfsIMQSt2uE4OcpQqbFu7f7NbTK05lx80nuSijCz7sc3a277R67g,"Berkat aplikasi ini, aq jadi mengerti gimana sistem investasi reksadana. Mudah dipahami.. penggunaan apk lancar. Bagi yang blum paham aplikasi ini membantu memilih investasi yang terbaik sesuai kebutuhan.",5,6,2.1.0,2020-04-15 09:05:58,,,2.1.0
4b25c35c-9033-46cb-8a59-6b4caf839b39,Risa Alviani Martian,https://play-lh.googleusercontent.com/a/ACg8ocLo2Ma2Gf9hMkJvdx0egsWWA1TSv8rF8GgrhTH4rEs0=mo,Ko setiap buka aplikasi bibit ini error mulu yah pada di update udah kenapa yah tolong buat admin nya kenapa saya tidak bisa buka aplikasi bibitnya? Tolong responnya Saya kasih bintang segini dulu karna aplikasinya tiba-tiba error begini,2,1,,2021-11-09 07:34:05,"Hai kak, kami mohon maaf atas ketidaknyamanan yg ditimbulkan. Terkait hal tsb, silahkan coba force close & clear cache terlebih dahulu, lalu buka aplikasi Bibit kembali. Untuk panduan force close & clear cache atau pertanyaan lebih lanjut, hubungi live chat Bibit atau WA +622150864230 agar tim kami dapat segera bantu masalah kakak. Terima kasih",2021-11-09 09:48:21,
691984fa-ebfa-4ec7-bdd7-4666e2a58bbe,Heyu Apakabars,https://play-lh.googleusercontent.com/a/ACg8ocJMPRC2FYkEevzGOPfjHeQyINM5vXfKKvZk3EP2eK1D=mo,"Ga rekomend, penarikan lama, top up lama, semua serba lama, yg namanya naro duit tu berarti bisa sewaktu waktu di ambil kalo butuh, ini mah harus nunggu lama banget, 7 hari kerja tapi ga selesai selesai, jangan di download deh, nyesel, mendingan pake aplikasi lain, aplikasi lain ga sampe 10menit cair, duh ga lagi lagi dah invest disini, nyesel bgt.",1,1,,2022-01-20 04:04:53,"Hai kak, pembelian dan penjualan reksa dana memang tidak realtime, karena membutuhkan proses verifikasi dari Manajer Investasi. Jadi prosesnya membutuhkan waktu sampai dengan maksimal 2 hari kerja. Info lebih lanjut hubungi layanan live chat Bibit atau WA +622150864230, tim support kami pasti akan langsung membantu kakak. Terima kasih",2022-01-20 04:21:59,
0561ef8a-3845-4f14-9222-826753a52215,Mohamad Fahri,https://play-lh.googleusercontent.com/a/ACg8ocKLys-Bh82oWJsY_Z7kGgnbY4v2r7obN4nSsvSChH9A=mo,"Sebetulnya aplikasi ini bagus ""kalo"" kita nilai dari pertama daftar, panduannya serta proses investasinya. Bahkan untuk pemula seperti saya yg sama sekali tidak tau investasi itu. Tapi kekecewaan datang ketika proses penjualan reksadana proses uang masuk ke rekening kita itu lama sekali. Males kali kalo gini caranya buat investasi lebih di aplikasi ini",2,64,3.7.1,2021-05-03 21:56:04,"Hai Fahri, seluruh transaksi di Pasar Modal harus mengikuti regulasi dari OJK ya, termasuk Bibit. Batas waktu pencairan dana Reksadana ke rekening nasabah yg dikirim oleh Bank Kustodian maks 3 hari kerja utk RD Pasar Uang dan maks 7 hari kerja utk RD Saham & Obligasi. Info lebih lanjut silahkan hubungi live chat Bibit/WA +622150864230. Terimakasih",2021-05-05 04:19:55,3.7.1
caaa75cd-8ca6-422c-a5ac-b3907a7adb57,Alpin Tri Khatami,https://play-lh.googleusercontent.com/a-/ALV-UjUH6KoFbp5iuCSvvk1EYfFnQBKnYrQS1RQ7wcyVWza3NZQ,tolong lah di perbaiki bug limit pembayaran yang blum terselesaikan. ada solusinya gitu misalnya ada pilihan batalkan pesanan. atau jangan masukin limit untuk pesanan yang belum terbayar. ngeselin banget,1,9,3.22.1,2021-12-09 15:04:23,,,3.22.1
83b1eb8d-7652-4ba2-a367-3f4ee60ff2d9,Hendra Fernando,https://play-lh.googleusercontent.com/a/ACg8ocL8CiNZjuOxRhqAcMOKD50JZ7rYUEAmW7QT3-OeV4aw=mo,"Klo aplikasi nya bagus,cuma lambat dalam segala hal. Beli,jual lama di proses. Beli saham tuh 1 detik aja dh berubah dan bahaya,,nie proses jual dan beli smpai berhari2. Tidak prnh sesuai sama yg ingin kita dapatkan karena lamaaaaaaaaaaaa.",3,1,3.0.11,2020-09-06 07:28:25,,,3.0.11
75439042-fd14-4669-bf0e-2226057a0600,Pengguna Google,https://play-lh.googleusercontent.com/EGemoI2NTXmTsBVtJqk8jxF9rh8ApRWfsIMQSt2uE4OcpQqbFu7f7NbTK05lx80nuSijCz7sc3a277R67g,"Aplikasi bagus, buat pemula yang ingin cocok sekali. Tapi, buat beberapa hal dalam membuka aplikasi terkadang lemot",5,1,1.3.2,2020-02-12 11:37:52,,,1.3.2
8bf1de94-087e-4ace-91c9-77312905c499,Fajar Nanang,https://play-lh.googleusercontent.com/a-/ALV-UjUn388-wmoJEq76Rt-s3JDEPOSqLxSeRYYzfyCAsgGamR0,"Awalnya bagus, setelah 5bln ikut yg nabung rutin jadi 400rb, marginnya habis, begitu di jual kok yg masuk ke rekening tinggal 50rb. Ini karena memang blm total di proses atau bagaimana??kl ada penjelasan yg masuk akal baru saya ubah review saya..",2,2,,2021-12-29 13:33:47,"Hai kak, pencairan dana ditransfer langsung dari Bank Kustodian setiap produk reksadana bisa saja berbeda waktunya. Jika dana penjualan blm diterima & sudah batas waktu dari tanggal Order Jual Berhasil (3 hari kerja utk RD Pasar Uang & 7 hari kerja utk RD Saham dan Obligasi). Silahkan langsung hubungi live chat Bibit/WA +622150864230. Terima kasih",2021-12-30 01:09:49,
60b45aa4-b206-4f9e-985e-8ce4da987ebd,Zaky Ramadhan,https://play-lh.googleusercontent.com/a-/ALV-UjV2hTF4LhSwlUrAWtp0w0Ta4axpfIa3KLkapkEhiVjvtfY,"Maaf untuk aplikasi bibitnya saya kasih bintang satu,saya kesini belajar untuk investasi,malahan yang konon katanya cocok buat pemula,saya kecewa terhadap apk bibit ini sekarang karena tidak bertindak cepat untuk pemulihan bug nya,, saya ingin tarik dana semuanya untuk nge klik aja tidak bisa,, untuk apk bibit sudahlah untuk sponsor nya, lebih fokuskan aja ke masalah apk dan tarik dana nya memakan 1 minggu bahkan tidak bisa dikembalikan, untuk apk bibit mohon tanggung jawabnya",1,114,3.16.3,2021-09-12 17:15:25,"Hai kak, kebijakan dari Bibit kakak baru bisa jual reksa dana 1 hari kerja setelah tanggal pembelian berhasil sekitar pukul 17.00-22.00 WIB, untuk status order silahkan cek di menu transaksi ya & butuh waktu pencairan maks 7 hari kerja. Info lebih lanjut hubungi live chat/WA +622150864230, tim support kami akan segera membantu kakak. Terima kasih",2021-09-13 04:23:08,3.16.3
19f21748-2896-413a-b7a3-afc93563a520,bintang star,https://play-lh.googleusercontent.com/a-/ALV-UjWJNOHjqZfi6R3qQCKKhCy_HCth4tma-ck3bh2bBS_hVw,"3 tahun lalu iseng nabung 1jt d aplikasi ini karena ganti hp jadi lupa dan sekarang baru inget klo punya tabungan d bibit duit ny g hilang malahan jadi nambah returnny 28% nyesel bgt dulu d lupain, intinya skrg fokus nabung rutin. Buat temen2 yg baru gabung jangan lupa pake kode referral (untung6) banyak cashbackny awal daftar langsung dapet 25rb dan setelah ny masih banyak lg cashback ny. Oh iyh sekarang pencarian g sampe 7 hari kmren narik 2 hari cair malah sekrang ada pencairan instan ny.",5,1,,2022-11-25 20:24:22,,,
f830dadb-ffbb-4c79-a02a-2fba3d282461,Sandi Sandewa,https://play-lh.googleusercontent.com/a-/ALV-UjXnsTCWT9luc0DyLd6WVFu9e62H8qvyWJIxE_AKNKPaz7mx,"Keren sih aplikasi bibit, saya juga termasuk pemula dalam bidang investasi, jdi dengan make bibit udh diatur sesuai dengan profil kita dan semua reksadananya pilihan. Jadinya gk perlu takut atau ragu lgi",5,9,3.2.1,2020-11-07 16:26:35,,,3.2.1
e49a030f-2ead-43e9-af09-b29c6cda295d,dalyati Purwanti,https://play-lh.googleusercontent.com/a-/ALV-UjVtenGfvWb0JxAxM5FAk72yDCe77uISXZlKh2ST2DazSdU,app terlalu lama hasil nya 1. penjualan aset lama 2. masuk ke rekening lama 3.mendapatkan propit saldo besar hasil ya kecil. 4.terlalu banyak libur mebuang2 waktu. masa malah deposito di bank bunga sebulan sudah ada hasil ya masuk ke rekening. ini apa investasi lama. kecil Parah bibit,1,1,,2022-03-06 13:07:07,"Hai kak, dana penjualan dikirim Bank Kustodian ke rekening terdaftar di Bibit sesuai ketentuan OJK maks 3 hari kerja utk RD Pasar Uang dan maks 7 hari kerja utk RD Saham & Obligasi. Pastikan rekening aktif dan cek mutasi rekening di waktu tsb. Info lebih lanjut hubungi live chat Bibit/WA +622150864230, tim support kami pasti akan membantu. Trims
",2022-03-06 13:42:06,
aeb9457b-728d-4d87-8cea-aafe9cb0194f,Mitha Damanik,https://play-lh.googleusercontent.com/a-/ALV-UjVuuxp2Gh2KK59l8kP1YDPh-prLZ4XsWG-uiQoiVZGBnEc,"Aplikasinya bagus bgtt buat pemula yg mau mulai investasi👍. Yok yang mau daftar bibit dan mau belajar investasi, saat mendaftar bisa pake kode referal ini : yoknabungsantuy. Langsung dapat cashback 25 ribu lhoo. Selamat mencoba✨.",5,1,,2020-10-02 02:53:52,,,
2141cff0-0247-4736-920b-4dd977a840c8,Phattar Official,https://play-lh.googleusercontent.com/a-/ALV-UjUv31sLLWzHpp5cBT_8L8Ou9UBr-rnlHnMew9Q6b5_ZVg,"Aplikasinya rapi bersih enak dipandang bangett, tapi agak gak seru karena pertumbuhan saham yang lambat. Tergantung company nya sih tapi semua cenderung kayak udah di balance gituu jadi gak terlalu beresiko",4,0,,2022-11-22 10:26:46,,,
7d9351cf-cb18-4bd8-bbde-2f51bc98e999,Pengguna Google,https://play-lh.googleusercontent.com/EGemoI2NTXmTsBVtJqk8jxF9rh8ApRWfsIMQSt2uE4OcpQqbFu7f7NbTK05lx80nuSijCz7sc3a277R67g,"Saya dah makai aplikasi ini sekitar 2 bulan dan menurut saya aplikasi ini sangat bagus baget buat investasi di reksa dana. Tampilan yang simple ada juga pengaturan resiko yg membuat orang pemula bisa mudah paham. Yang paling penting menurut aku sih ada tombol eksekusi untuk reksadana yang sariah jadi apapun yg dibeli syariah itu yg paling mantap... oh iya buat kawan-kawan yang baru bisa pakai refferal aku ya ""mnoor"" biar dapat cashback Rp. 50.000 lumayan...",5,9,1.2.5,2019-07-05 13:23:54,,,1.2.5
ceb6b2fb-37a1-4bfe-ba91-696816c2f359,Pengguna Google,https://play-lh.googleusercontent.com/EGemoI2NTXmTsBVtJqk8jxF9rh8ApRWfsIMQSt2uE4OcpQqbFu7f7NbTK05lx80nuSijCz7sc3a277R67g,"Baru mulai berinvestasi di bibit, belum terlalu lama tapi sejauh ini tampilan dan bahasa yang digunakan dalam aplikasi cukup keren dan mudah dipahami bahkan oleh anak SD sekalipun. Mau dapat cashback, masukin kode referral: berbagirejeki. Ingat, kode referralnya huruf kecil semua ya. Salam investasi.",4,1,,2020-01-10 15:48:45,,,
4b0ac11b-bb30-402d-b9f6-6c999320a966,"IsiKode “9810233” Novellah,dpt bonus",https://play-lh.googleusercontent.com/a-/ALV-UjWym-unjjsYTx2JBoyoSR8I0GgFBdl8gZolm7Y8lemUsQ,"Aplikasi yg sedang ramai di rekomendasikan utk semua pencinta aplikasi online,,,aku udh ngerasain gimana bagus dan mudahnya berinvestasi pakai bibit,aplikasinya oke,tampilan menarik,fitur lengkap serta sistem yg sangat bagus membuat aplikasinya berjalan dengan sangat lancar tanpa kendala,,,aplikasi bibit lebih mengerti kebutuhan penggunanya sehingga sangat mudah mendapatkan keuntungan yg lebih besar pakai bibit.",5,0,,2022-09-28 06:27:23,,,
5c81590b-6020-49d1-9c97-483ba2902381,Anis Miftachurrochmah,https://play-lh.googleusercontent.com/a-/ALV-UjWEZjit5wmn8PLrsWOfswnLHFKbcbULmETZRVq1uFjT5wQ,"Aplikasi yg bagus,jadi bisa memetakan uang berdasarkan tujuan. Dan pastinya jadi lebih semangat untuk investasinya. Jangan lupa pakai kode referral aku ya: anismifta Biar dapat cashback 25k hehe",5,1,3.2.1,2021-01-14 05:03:38,,,3.2.1
bf7e1e34-275d-4691-8fe4-0f28323561d2,Zulkifli zulkifli,https://play-lh.googleusercontent.com/a-/ALV-UjU_z4bTXqt89um-suLF6g9bCRLBpZiY6VKORN-T0JXovYo,"Untung saya gak ikutan jd gak ada keluhan apapun, ingin dapat uang banyak ya harus kerja keras jangan berharap seperti ini, hati2 banyak penipuan berkedok investasi!!! Kalo mo investasi harus jelas perusahaannya, sdh terdaftar di pemerintah yg berbasis bisnis ini belum?! Jgn sampe kecewa gara2 ingin dpt uang yg gampang dan super instan",1,3,,2021-11-14 23:49:25,"Hai kak, tidak perlu khawatir karena Bibit sudah resmi terdaftar dan diawasi oleh OJK dgn nomor surat KEP-14/PM.21/2017. Jika kakak memiliki pertanyaan atau membutuhkan bantuan, kakak bisa langsung menghubungi tim support kami yg siap membantu selama 24 jam melalui live chat/WA +622150864230. Terima kasih",2021-11-15 01:18:32,
7793da54-7f8c-4e53-857d-2161a4a8a8aa,Jimmy SuLu,https://play-lh.googleusercontent.com/a-/ALV-UjW8qt8d19GfDNWIJxsOpyphS0wBmh8y5g5Er8iL_fMxhyM,Amplikasi setelah update malah lemot sekali dan sangat lama masuk ke amplikasi awal...utk masalah invest nya sih ok.tolong dong utk perbaikan bugs nya,3,3,3.17.1,2021-09-27 02:57:27,,,3.17.1
ff145508-7c97-4240-8dce-77683c867d18,Asep Suherdis,https://play-lh.googleusercontent.com/a/ACg8ocLrUua0HfXQOxwPeeE0KSCFc8Ns8uDEnm2Ruc9-osZc=mo,"Untuk berinvestasi 1 atau 2 hari sudah masuk. Tapi pencairan, membutuhkan maksimal 7 hari. 3 hari saja sudah berasa lama. Karena uangnya dibutuhkan. Saya sudah 4 hari kerja saja masih belum cair. Saya kira seperti top up bisa cepat ditangani. Ternyata sudah pengajuan lama, pencairan pun lama 😑",3,4,,2021-11-09 01:45:53,,,
4e76293f-3b8b-48ca-a788-d66ccdb4c59f,Masyudi,https://play-lh.googleusercontent.com/a-/ALV-UjWq77Z8fU-uvipxZlY-waEk_8qTsWzJL665wADzmSYRsJo,"Soal Kecepatan nabung sangat lama sekali, dan kecepatan untuk tarik dana juga lama sekali, fitur untuk top up juga tidak ada indomaret. harus menggunakan debit, jadi bagi ada yang tidak punya debit. mending di tokopedia aja nabungnya",3,56,3.48.1,2023-01-16 00:16:12,,,3.48.1
b3cd8f1f-f83a-462a-bb36-190c7535f549,Pengguna Google,https://play-lh.googleusercontent.com/EGemoI2NTXmTsBVtJqk8jxF9rh8ApRWfsIMQSt2uE4OcpQqbFu7f7NbTK05lx80nuSijCz7sc3a277R67g,"aplikasi sangat mudah d gunakan untuk pemula dalam investasi reksadana terutama fitur robo sangat2 membantu,tapi masih ada kurangnya yaitu untuk produk sbr dan sejenisnya blm ada dalam aplikasi bibit..oiiya buat yang baru mau coba app bibit,bisa input code refferal "" tirta3 "" tanpa tanda kutip supaya dapat welcome bonus dari bibit",5,1,,2019-08-15 08:29:23,,,
1a740c1a-0d67-4f08-ae90-c199a9621459,Adji Saka,https://play-lh.googleusercontent.com/a-/ALV-UjUvLWToxPtv6SacdaayWuvR8CVq8fzLGV7r2qIsL_olQw,"Yang komen aplikasi bibit gak bagus lah,ribet,itu salah besar,bibit memang luaar biasa,yg pasti nabung dibibit lebih untung dari pada di bank biasa,,saya kasih bintang 5,semoga semakin maju lagi,tolong di buat fitur masuk aplikasi pakek pin atau paswoord buat aplikasinya,biar tidak bisa dibuka orang,dan lebih terjamin keamanannya,salam cuan",5,118,3.8.0,2021-04-29 14:11:16,,,3.8.0
66b11ca1-a5af-4b6e-9ab6-29e6ba626a54,Bagus Dwi Susanto,https://play-lh.googleusercontent.com/a-/ALV-UjXJNvOvj5geBJUo3ma9MCm6Jn0K0ULnsh_E0-TjVj33iktC,"Aplikasinya sangat mudah dipahami. Tapi saya punya kendala saat ingin melakukan verifikasi wajah. Karena saya menggunakan kacamata. Saya tidak bisa membaca dengan jelas instruksi (buka mulut, kedip mata, tengok kepala). Sehingga gagal terus. Mohon dikembangkan untuk diberi instruksi berupa suara. Terima kasih.",4,75,3.17.1,2021-10-04 11:21:16,,,3.17.1
5f1082ee-7391-4856-951c-1f7250058e73,Pengguna Google,https://play-lh.googleusercontent.com/EGemoI2NTXmTsBVtJqk8jxF9rh8ApRWfsIMQSt2uE4OcpQqbFu7f7NbTK05lx80nuSijCz7sc3a277R67g,"UI yang nyaman dipandang, selama ini belum ada masalah ketika menggunakan aplikasi. Kalau bisa channel pembayaran ditambah dong contohnya lewat OVO. Keep up the good work, Bibit!",5,12,1.3.0,2019-11-08 06:08:43,,,1.3.0
b2dfc23d-1fd4-42f2-bd11-4a93c8b0b5dd,Syaikhul Ghulam,https://play-lh.googleusercontent.com/a-/ALV-UjX4WSDW34dAV_kY3Iq1Kg0ta_7aH-AFhsJ7OefBd0LCRbY,"Aplikasinya bagus, mohon untuk pihak developer kedepannya ada perubahan/penambahan S&K saat mau daftar di bibit, soalnya banyak Temen saya ingin berinvestasi di Bibit tapi terkendala tidak mempunyai Rekening Bank pribadi, Trimakasih 😀😁🙏",5,112,3.6.0,2021-02-27 11:11:02,,,3.6.0
e2eba23a-d943-4499-a260-14b215f27d02,Pengguna Google,https://play-lh.googleusercontent.com/EGemoI2NTXmTsBVtJqk8jxF9rh8ApRWfsIMQSt2uE4OcpQqbFu7f7NbTK05lx80nuSijCz7sc3a277R67g,"Aplikasinya gampang di pelajari, ada artikel bagus yang bisa membantu. Petunjuk investasinya juga jelas, gampang di akses gak bikin bingung. Jadi makin semangat buat nabung",5,4,1.2.5,2019-07-31 00:16:45,,,1.2.5
1c25e12b-61bb-48e5-a7ee-7cf3574c3eb7,Muhammad Misbahul Munir,https://play-lh.googleusercontent.com/a-/ALV-UjUu5dvv3mzi4bS2_CHnilSxh8xFq6x7sWneeoKWU4i63_UM,"buat pemula di bidang investasi seperti saya, aplikasi Bibit ini sangat newbie friendly. Gampang digunakan, supportnya juga oke punya, apapun yang nggak saya pahami bisa langsung dicari di dalam aplikasi, ada forum Telegramnya juga. Tabungan di bank yang lama mengendap bisa jadi cuan karena bantuan Bibit 👍",5,3,2.2.2,2020-07-08 03:59:51,,,2.2.2
e73ea2d1-9929-47b1-9e45-448c52d07562,fauzi fadilla,https://play-lh.googleusercontent.com/a-/ALV-UjWer5A0XjoH6Hgg6Zq0qoWTXlQsLcCV_rEsSD64i_k-5EUA,Dengan pendaftaran yang mudah. Dan transaksi yang mudah. Plus pelayanan web yg baik tanpa lag. . Bagus banget aplikasinya...,5,2,3.3.2,2021-01-05 00:10:26,,,3.3.2
2a61e3f9-8579-43c2-a755-607e880bf0f3,VANILLA,https://play-lh.googleusercontent.com/a-/ALV-UjUBspXhkbpRalM1E7RSJcBW0Ls59PbZFNoCjCOBX6yqTOk,"Aplikasinya bagus utk investasi pemula, utk beli sangat mudah, dan penjualan jg gak butuh waktu lama, sekitar 7 hari kerja tpi kemaren saya coba jual, 5 hari udah cair. Saya percaya sama ni aplikasi, jgn takut coba.",5,16,3.2.3,2020-12-04 07:12:03,,,3.2.3
a33b856e-6917-4a39-b749-c2422e23ea6f,Pengguna Google,https://play-lh.googleusercontent.com/EGemoI2NTXmTsBVtJqk8jxF9rh8ApRWfsIMQSt2uE4OcpQqbFu7f7NbTK05lx80nuSijCz7sc3a277R67g,"Bibit keren, memudahkan pengguna newbie dan mudah mengoperasikannya serta ad auto pilotnya jadi tidak perlu ngecek terus menerus. .",5,1,1.2.10,2019-10-04 02:58:51,,,1.2.10
bf31e691-2a6c-45ba-9de5-2e3da7873d18,Riki julianus,https://play-lh.googleusercontent.com/a-/ALV-UjW3qTzRIeTT0NH6rHu3nuubWjRBdu_YsGqnzn9qq7zkuw,"Keren apps ini, baru 4 hari udah masuk. Tpi kecewanya saldo saya isi lewat link aja gak3 masuk di bibit, padahal saldo linkaja udah terpotong, tanya sama linkaja udah terproses, tanya bibit nunggu konfir dari link aja lagi. Saya tunggu kedua apps itu komfir lagi lah.",5,6,3.2.3,2020-12-01 16:15:26,,,3.2.3
33cc0fc1-6855-421f-83a3-b186ce07d47f,News Ilham Production,https://play-lh.googleusercontent.com/a-/ALV-UjUCnZ-elzRTXH4O_9Wx1b184U0Swhza92YVgoHayYwzwJY,"Cocok buat permula yang ingin belajar investasi, karena dengan tampilan ya yang simple dan mudah, serta admin yang selalu cepat membantu kita, dalam urusan yang kurang di mengerti, buruan daftar sekarang!",5,3,3.8.0,2021-06-12 06:51:23,,,3.8.0
e4ac4b59-1df0-4e9d-bd22-fadb3142b528,Agus Setyawan,https://play-lh.googleusercontent.com/a/ACg8ocLx3lOG2hADptqz93Zn2ft3kDLQv-O6S-Z5ya8ondeD=mo,"Mudah digunakan, user interface friendly, update berita tentang pembaharuan MI, mudah untuk top up karena banyak pilihan metode pembayaran. Makin banyak fitur-fitur asyik.",5,55,3.21.0,2021-12-09 08:00:24,,,3.21.0
